{
  "$schema": "http://json-schema.org/draft-07/schema#",
  "$id": "https://esphome.io/schemas/device-builder/board.schema.json",
  "title": "ESPHome Device Builder Board Definition",
  "description": "Schema for board manifest.yaml files in the ESPHome Device Builder.",
  "type": "object",
  "required": ["id", "name", "esphome"],
  "additionalProperties": false,
  "properties": {
    "id": {
      "type": "string",
      "description": "Unique board identifier. Must match the folder name.",
      "pattern": "^[a-zA-Z0-9][a-zA-Z0-9_.-]*$"
    },
    "name": {
      "type": "string",
      "description": "Human-readable board name."
    },
    "description": {
      "type": "string",
      "description": "Board description. Supports markdown."
    },
    "manufacturer": {
      "type": "string",
      "description": "Board manufacturer or vendor name."
    },
    "esphome": {
      "type": "object",
      "description": "ESPHome platform configuration for this board.",
      "required": ["platform", "board"],
      "additionalProperties": false,
      "properties": {
        "platform": {
          "type": "string",
          "description": "ESPHome platform.",
          "enum": ["esp32", "esp8266", "rp2040", "bk72xx", "rtl87xx", "ln882x", "nrf52", "host"]
        },
        "board": {
          "type": "string",
          "description": "PlatformIO board identifier."
        },
        "variant": {
          "type": ["string", "null"],
          "description": "ESP32 chip variant. Only for esp32 platform.",
          "enum": ["esp32", "esp32s2", "esp32s3", "esp32c2", "esp32c3", "esp32c5", "esp32c6", "esp32c61", "esp32h2", "esp32p4", null]
        },
        "framework": {
          "type": ["string", "null"],
          "description": "Build framework override. Omit or null for platform default.",
          "enum": ["arduino", "esp-idf", "zephyr", null]
        }
      }
    },
    "hardware": {
      "type": "object",
      "description": "Hardware specifications.",
      "additionalProperties": false,
      "properties": {
        "flash_size": {
          "type": "string",
          "description": "Flash memory size.",
          "examples": ["2MB", "4MB", "8MB", "16MB"]
        },
        "ram_size": {
          "type": "integer",
          "description": "RAM size in bytes."
        },
        "cpu_frequency": {
          "type": "string",
          "description": "CPU clock frequency.",
          "examples": ["80MHz", "160MHz", "240MHz"]
        },
        "connectivity": {
          "type": "array",
          "description": "Connectivity features.",
          "items": {
            "type": "string"
          }
        }
      }
    },
    "images": {
      "type": "array",
      "description": "Board images. URLs or paths relative to the manifest. First is primary.",
      "items": {
        "type": "string"
      }
    },
    "tags": {
      "type": "array",
      "description": "Unique feature tags not captured by platform/variant/connectivity.",
      "items": {
        "type": "string",
        "enum": [
          "compact", "dev-kit", "starter-kit", "module", "breakout",
          "display", "camera", "rgb-led", "relay", "motor-driver", "sd-card",
          "microphone", "speaker", "imu",
          "lipo", "poe", "usb-c", "external-antenna", "solar", "battery",
          "sonoff", "tuya", "shelly"
        ]
      }
    },
    "pins": {
      "type": "array",
      "description": "GPIO pin definitions.",
      "items": {
        "$ref": "#/$defs/pin"
      }
    },
    "docs_url": {
      "type": "string",
      "description": "Link to ESPHome documentation for this platform.",
      "format": "uri"
    },
    "product_url": {
      "type": "string",
      "description": "Link to manufacturer product page.",
      "format": "uri"
    },
    "featured": {
      "type": "boolean",
      "description": "Highlighted board (e.g. official ESPHome starter kits).",
      "default": false
    },
    "is_generic": {
      "type": "boolean",
      "description": "True for generic fallback boards where not all pins may be physically accessible.",
      "default": false
    },
    "featured_components": {
      "type": "array",
      "description": "Components recommended for this board. Surfaced as a 'Recommended' section in the Add Component dialog.",
      "items": { "$ref": "#/$defs/featured_component" }
    },
    "featured_bundles": {
      "type": "array",
      "description": "Logical groups of featured components added together (hardware addon modules, status-LED setups, ...).",
      "items": { "$ref": "#/$defs/featured_bundle" }
    },
    "source": {
      "type": "object",
      "description": "Marks the manifest as imported from an external catalog. Hand-curated boards omit this block; the sync script regenerates manifests where it's present and never touches manifests where it's absent.",
      "required": ["type", "remote_id"],
      "additionalProperties": false,
      "properties": {
        "type": {
          "type": "string",
          "description": "Origin marker. Drives which sync script owns this manifest.",
          "enum": ["esphome-devices"]
        },
        "remote_id": {
          "type": "string",
          "description": "Upstream identifier (folder name, page slug, ...) used to match this manifest back to its source on subsequent syncs."
        },
        "upstream_url": {
          "type": "string",
          "description": "Direct link to the source page on the upstream repo or site.",
          "format": "uri"
        },
        "upstream_revision": {
          "type": "string",
          "description": "Commit SHA (or version string) the manifest was generated from."
        },
        "content_hash": {
          "type": "string",
          "description": "SHA-256 of the upstream source content. Lets the sync skip already-up-to-date entries without re-rendering."
        }
      }
    }
  },
  "$defs": {
    "pin": {
      "type": "object",
      "description": "A GPIO pin on the board.",
      "required": ["gpio"],
      "additionalProperties": false,
      "properties": {
        "gpio": {
          "type": "integer",
          "description": "GPIO number.",
          "minimum": 0
        },
        "label": {
          "type": "string",
          "description": "Silkscreen label on the physical board (e.g. 'D1', 'GPIO0', 'A0')."
        },
        "features": {
          "type": "array",
          "description": "Pin capabilities and roles.",
          "items": {
            "type": "string",
            "enum": [
              "adc", "dac", "touch", "pwm",
              "i2c_sda", "i2c_scl",
              "spi_mosi", "spi_miso", "spi_clk", "spi_cs",
              "uart_tx", "uart_rx",
              "usb_dp", "usb_dm",
              "rgb_led", "jtag",
              "strapping", "input_only", "boot_button"
            ]
          }
        },
        "available": {
          "type": ["boolean", "null"],
          "description": "true = exposed on headers, false = not broken out, null = unknown (generic boards)."
        },
        "occupied_by": {
          "type": "string",
          "description": "Onboard component using this pin (e.g. 'Built-in LED', 'SPI Flash', 'BOOT button')."
        },
        "notes": {
          "type": "string",
          "description": "Extra guidance for the user."
        }
      }
    },
    "featured_component": {
      "type": "object",
      "description": "A component recommended for this board, optionally with pre-filled field values.",
      "required": ["id", "component_id"],
      "additionalProperties": false,
      "properties": {
        "id": {
          "type": "string",
          "description": "Local id, unique within this board (e.g. 'relay', 'pir_motion'). Lowercase letters / digits / underscores; must not equal the domain of component_id.",
          "pattern": "^[a-zA-Z0-9][a-zA-Z0-9_-]*$"
        },
        "component_id": {
          "type": "string",
          "description": "Underlying ComponentCatalogEntry id (e.g. 'switch.gpio').",
          "pattern": "^[a-z0-9_]+(\\.[a-z0-9_]+)?$"
        },
        "name": {
          "type": "string",
          "description": "Override for the component's display name."
        },
        "description": {
          "type": "string",
          "description": "Override for the component's description."
        },
        "fields": {
          "type": "object",
          "description": "Per-config-entry presets, keyed by ConfigEntry.key.",
          "additionalProperties": { "$ref": "#/$defs/field_preset_or_value" }
        }
      }
    },
    "featured_bundle": {
      "type": "object",
      "description": "A logical group of featured components added together.",
      "required": ["id", "name", "component_ids"],
      "additionalProperties": false,
      "properties": {
        "id": {
          "type": "string",
          "description": "Local id, unique within this board.",
          "pattern": "^[a-zA-Z0-9][a-zA-Z0-9_-]*$"
        },
        "name": {
          "type": "string",
          "description": "Display name for the bundle."
        },
        "description": {
          "type": "string",
          "description": "What the bundle represents (e.g. 'Onboard status LED')."
        },
        "component_ids": {
          "type": "array",
          "description": "Local ids referring to entries in featured_components on this same board.",
          "minItems": 1,
          "items": {
            "type": "string",
            "pattern": "^[a-zA-Z0-9][a-zA-Z0-9_-]*$"
          }
        }
      }
    },
    "field_preset_or_value": {
      "description": "Either a primitive shorthand (pre-fills a default), a list, or a verbose object form ({value, locked, suggestions}).",
      "oneOf": [
        { "type": ["string", "number", "integer", "boolean", "null"] },
        { "type": "array" },
        {
          "type": "object",
          "additionalProperties": false,
          "properties": {
            "value": {
              "description": "Pre-filled value. Optional when only suggestions are set."
            },
            "locked": {
              "type": "boolean",
              "description": "When true, frontend disables the input and the backend rejects deviating user input on add. Requires 'value'.",
              "default": false
            },
            "suggestions": {
              "type": "array",
              "description": "Limit the user's choice to this list (e.g. allowed GPIOs).",
              "minItems": 1,
              "items": { "type": ["string", "number", "integer", "boolean"] }
            }
          },
          "not": { "required": ["locked", "suggestions"] },
          "if": {
            "required": ["locked"],
            "properties": { "locked": { "const": true } }
          },
          "then": { "required": ["value"] }
        }
      ]
    }
  }
}
